{
  "$schema": "https://json-schema.org/draft/2020-12/schema",
  "$id": "https://github.com/effectstream/mint-test-tokens/raw/main/schema/metadata.schema.json",
  "title": "Effectstream Midnight test-token registry",
  "type": "object",
  "additionalProperties": false,
  "required": ["schemaVersion", "registryRevision", "status", "generatedAt", "network", "compatibility", "tokens"],
  "properties": {
    "schemaVersion": { "const": "1.0.0" },
    "registryRevision": { "type": "string", "minLength": 1 },
    "status": { "enum": ["unavailable", "deploying", "ready", "stale"] },
    "generatedAt": { "type": "string", "format": "date-time" },
    "network": {
      "type": "object",
      "additionalProperties": false,
      "required": ["key", "displayName", "protocolFamily", "networkId", "chainId", "stackIdentity"],
      "properties": {
        "key": { "enum": ["preview", "preprod", "stagenet", "undeployed"] },
        "displayName": { "type": "string", "minLength": 1 },
        "protocolFamily": { "enum": ["midnight-1.x", "midnight-2.x"] },
        "networkId": { "type": "string", "minLength": 1 },
        "chainId": { "type": ["string", "null"] },
        "stackIdentity": { "type": ["string", "null"] }
      }
    },
    "compatibility": {
      "type": "object",
      "additionalProperties": false,
      "required": ["profile", "compiler", "compactRuntime", "ledger", "midnightJs", "walletSdk"],
      "properties": {
        "profile": { "enum": ["v1", "v2"] },
        "compiler": { "type": "string", "minLength": 1 },
        "language": { "type": "string", "minLength": 1 },
        "compactJs": { "type": "string", "minLength": 1 },
        "compactRuntime": { "type": "string", "minLength": 1 },
        "ledger": { "type": "string", "minLength": 1 },
        "onchainRuntime": { "type": "string", "minLength": 1 },
        "midnightJs": { "type": "string", "minLength": 1 },
        "walletSdk": { "type": "string", "minLength": 1 }
      }
    },
    "tokens": {
      "type": "array",
      "minItems": 6,
      "maxItems": 6,
      "items": { "$ref": "#/$defs/token" }
    }
  },
  "$defs": {
    "token": {
      "type": "object",
      "additionalProperties": false,
      "required": ["symbol", "name", "decimals", "privacy", "domainSeparator", "faucet", "activeDeploymentId", "deployments"],
      "properties": {
        "symbol": { "enum": ["twBTC", "twETH", "twUSDC", "twUSDM", "utwUSDC", "utwBTC"] },
        "name": { "type": "string", "minLength": 1 },
        "decimals": { "type": "integer", "minimum": 0, "maximum": 255 },
        "privacy": { "enum": ["shielded", "unshielded"] },
        "domainSeparator": {
          "type": "string",
          "minLength": 1,
          "maxLength": 32,
          "description": "UTF-8 text encoded to at most 32 bytes, then right-padded with zero bytes to Bytes<32>; semantic validation enforces the byte limit."
        },
        "faucet": {
          "type": "object",
          "additionalProperties": false,
          "required": ["humanAmount", "baseUnits"],
          "properties": {
            "humanAmount": { "type": "string", "pattern": "^[1-9][0-9]*(\\.[0-9]+)?$" },
            "baseUnits": { "type": "string", "pattern": "^[1-9][0-9]*$" }
          }
        },
        "activeDeploymentId": { "type": ["string", "null"] },
        "deployments": { "type": "array", "items": { "$ref": "#/$defs/deployment" } }
      }
    },
    "deployment": {
      "type": "object",
      "additionalProperties": false,
      "required": ["deploymentId", "status", "contractAddress", "tokenId", "deploymentTransaction", "deployedAt", "verifiedAt", "network", "compatibility", "deploymentToolchain", "confirmation", "maintenanceAuthority", "artifact"],
      "properties": {
        "deploymentId": { "type": "string", "minLength": 1 },
        "status": { "enum": ["active", "superseded"] },
        "contractAddress": { "type": "string", "minLength": 1 },
        "tokenId": { "type": "string", "minLength": 1 },
        "deploymentTransaction": { "type": "string", "minLength": 1 },
        "deployedAt": { "type": "string", "format": "date-time" },
        "verifiedAt": { "type": "string", "format": "date-time" },
        "network": { "$ref": "#/properties/network" },
        "compatibility": { "$ref": "#/properties/compatibility" },
        "deploymentToolchain": {
          "anyOf": [
            {
              "type": "object",
              "additionalProperties": false,
              "required": ["runner", "runnerVersion", "walletSdk"],
              "properties": {
                "runner": { "type": "string", "minLength": 1 },
                "runnerVersion": { "type": "string", "minLength": 1 },
                "walletSdk": { "type": "string", "minLength": 1 }
              }
            },
            { "type": "null" }
          ]
        },
        "confirmation": {
          "type": "object",
          "additionalProperties": false,
          "required": ["blockHeight", "blockHash"],
          "properties": {
            "blockHeight": { "type": "string", "pattern": "^(0|[1-9][0-9]*)$" },
            "blockHash": { "type": "string", "minLength": 1 }
          }
        },
        "maintenanceAuthority": {
          "type": "object",
          "additionalProperties": false,
          "required": ["status", "address"],
          "properties": {
            "status": { "enum": ["retained", "renounced", "unknown"] },
            "address": { "type": ["string", "null"] }
          }
        },
        "artifact": {
          "type": "object",
          "additionalProperties": false,
          "required": ["sourceRevision", "compilerVersion", "artifactSha256", "openZeppelinRelease"],
          "properties": {
            "sourceRevision": { "type": "string", "pattern": "^[0-9a-f]{40}$" },
            "compilerVersion": { "type": "string", "minLength": 1 },
            "artifactSha256": { "type": "string", "pattern": "^[0-9a-f]{64}$" },
            "openZeppelinRelease": { "type": ["string", "null"] }
          }
        },
        "compatibilityVerifications": {
          "type": "array",
          "items": { "$ref": "#/$defs/clientCompatibilityVerification" }
        }
      }
    },
    "clientCompatibilityVerification": {
      "type": "object",
      "additionalProperties": false,
      "required": ["deploymentId", "deploymentArtifactSha256", "compatibility", "artifact", "verifiedAt"],
      "properties": {
        "deploymentId": { "type": "string", "minLength": 1 },
        "deploymentArtifactSha256": { "type": "string", "pattern": "^[0-9a-f]{64}$" },
        "compatibility": {
          "allOf": [
            { "$ref": "#/properties/compatibility" },
            { "type": "object", "required": ["language", "compactJs", "onchainRuntime"] }
          ]
        },
        "artifact": {
          "type": "object",
          "additionalProperties": false,
          "required": ["sourceRevision", "compilerVersion", "artifactSha256"],
          "properties": {
            "sourceRevision": { "type": "string", "pattern": "^[0-9a-f]{40}$" },
            "compilerVersion": { "type": "string", "minLength": 1 },
            "artifactSha256": { "type": "string", "pattern": "^[0-9a-f]{64}$" }
          }
        },
        "verifiedAt": { "type": "string", "format": "date-time" }
      }
    }
  }
}
