{
  "schemaVersion": "1.0.0",
  "registryRevision": "unreleased",
  "status": "unavailable",
  "generatedAt": "2026-09-07T00:00:00.000Z",
  "network": {
    "key": "preprod",
    "displayName": "Preprod",
    "protocolFamily": "midnight-1.x",
    "networkId": "preprod",
    "chainId": null,
    "stackIdentity": null
  },
  "compatibility": {
    "profile": "v1",
    "compiler": "0.31.1",
    "compactRuntime": "0.16.0",
    "ledger": "8.1.0",
    "midnightJs": "4.1.1",
    "walletSdk": "1.2.0"
  },
  "tokens": [
    {
      "symbol": "twBTC",
      "name": "Test-wrapped BTC",
      "decimals": 8,
      "privacy": "shielded",
      "domainSeparator": "mint-test-tokens:twBTC",
      "faucet": {
        "humanAmount": "1",
        "baseUnits": "100000000"
      },
      "activeDeploymentId": null,
      "deployments": []
    },
    {
      "symbol": "twETH",
      "name": "Test-wrapped ETH",
      "decimals": 18,
      "privacy": "shielded",
      "domainSeparator": "mint-test-tokens:twETH",
      "faucet": {
        "humanAmount": "5",
        "baseUnits": "5000000000000000000"
      },
      "activeDeploymentId": null,
      "deployments": []
    },
    {
      "symbol": "twUSDC",
      "name": "Test-wrapped USDC",
      "decimals": 6,
      "privacy": "shielded",
      "domainSeparator": "mint-test-tokens:twUSDC",
      "faucet": {
        "humanAmount": "10000",
        "baseUnits": "10000000000"
      },
      "activeDeploymentId": null,
      "deployments": []
    },
    {
      "symbol": "twUSDM",
      "name": "Test-wrapped USDM",
      "decimals": 6,
      "privacy": "shielded",
      "domainSeparator": "mint-test-tokens:twUSDM",
      "faucet": {
        "humanAmount": "10000",
        "baseUnits": "10000000000"
      },
      "activeDeploymentId": null,
      "deployments": []
    },
    {
      "symbol": "utwUSDC",
      "name": "Unshielded-test-wrapped USDC",
      "decimals": 6,
      "privacy": "unshielded",
      "domainSeparator": "mint-test-tokens:utwUSDC",
      "faucet": {
        "humanAmount": "10000",
        "baseUnits": "10000000000"
      },
      "activeDeploymentId": null,
      "deployments": []
    },
    {
      "symbol": "utwBTC",
      "name": "Unshielded-test-wrapped BTC",
      "decimals": 8,
      "privacy": "unshielded",
      "domainSeparator": "mint-test-tokens:utwBTC",
      "faucet": {
        "humanAmount": "1",
        "baseUnits": "100000000"
      },
      "activeDeploymentId": null,
      "deployments": []
    }
  ]
}
